<?xml version="1.0" encoding="UTF-8"?>
<enumerationModel xmlns="http://www.ibm.com/xmlns/prod/streams/spl/enumeration"
                 xmlns:xsi="http://www.w3.org/2001/XMLSchema-instance"
                 xsi:schemaLocation="http://www.ibm.com/xmlns/prod/streams/spl/enumerator enumerationModel.xsd">

   <class>LogLevel</class>

   <enumerators>
      <enumerator>
         <name>error</name>
      </enumerator>

      <enumerator>
         <name>info</name>
      </enumerator>

      <enumerator>
         <name>debug</name>
      </enumerator>

      <enumerator>
         <name>trace</name>
      </enumerator>
   </enumerators>

</enumerationModel>
